{
  "task_id": "LANGUAGE-LEARNING-APP-IMPLEMENTATION-CANON-AND-READINESS-002B",
  "verdict": "ACCEPTED",
  "documentation_only": true,
  "implementation_canon_complete": true,
  "platform_canon_complete": true,
  "responsive_layout_canon_complete": true,
  "design_system_complete": true,
  "accessibility_canon_complete": true,
  "navigation_canon_complete": true,
  "frontend_architecture_complete": true,
  "backend_architecture_complete": true,
  "api_canon_complete": true,
  "database_canon_complete": true,
  "authentication_canon_complete": true,
  "ai_gateway_canon_complete": true,
  "dangerous_action_gates_complete": true,
  "audio_canon_complete": true,
  "notification_canon_complete": true,
  "offline_recovery_canon_complete": true,
  "security_canon_complete": true,
  "privacy_canon_complete": true,
  "testing_canon_complete": true,
  "device_matrix_complete": true,
  "ci_quality_gates_complete": true,
  "observability_canon_complete": true,
  "environment_canon_complete": true,
  "code_quality_canon_complete": true,
  "git_delivery_canon_complete": true,
  "change_control_complete": true,
  "vertical_slice_003_readiness_verified": true,
  "application_code_changed": false,
  "runtime_code_added": false,
  "database_migrations_added": false,
  "real_llm_calls_executed": false,
  "deployment_executed": false,
  "staging_modified": false,
  "production_modified": false,
  "secrets_added": false,
  "tests": {
    "tests_total": 36,
    "tests_passed": 36,
    "tests_failed": 0,
    "warnings": 0
  },
  "traceability": {
    "requirements_total": 43,
    "requirements_traced": 43,
    "requirements_untraced": 0,
    "broken_links": 0
  },
  "git": {
    "branch": "master",
    "starting_commit": "1a1c1e1d047be30328c84daf77a4fd22e7b386ec",
    "final_commit": "e89a15b4c8c8f47f25c583aa282d651e2367cc8f",
    "commit_created": true,
    "commit_pushed": true,
    "git_clean": true,
    "head_matches_origin": true,
    "unpushed_commits": 0,
    "uncommitted_changes": 0
  },
  "unresolved_blockers": [],
  "current_state": "implementation_canon_complete",
  "next_allowed_action": "first_mvp_vertical_slice_implementation_003",
  "application_implementation_allowed": true,
  "production_accepted": false
}
